{
  "schemaVersion": 1,
  "trustStoreVersion": 1,
  "trustedControllerManifest": {
    "manifestId": "threadleaf-level4-controller-main",
    "manifestVersion": 1,
    "controllerVersion": "level4-controller-v2-phase0",
    "controllerExecutableSha256": "6b347d6ab618099d84c614b6f0142bf818fe075799887e3f980d8af4cac17939",
    "executableClosureSha256": "db767ba232d9dbbf2ec721b3f401865ea8d566b07bb62448a75d3ac86d3e39fa",
    "executableClosure": {
      "schemaVersion": 1,
      "roots": [
        "scripts/compatibility/level4-controller.mjs",
        "scripts/compatibility/level4-verifier.mjs"
      ],
      "entries": [
        {
          "path": "node_modules/.pnpm/canonicalize@2.1.0/node_modules/canonicalize/lib/canonicalize.js",
          "bytes": 1108,
          "sha256": "8a22f6848f00747463146fbfb11619944fc5800cf8f1ff0dfb9eb6489a05fe21"
        },
        {
          "path": "scripts/compatibility/level4-artifacts.mjs",
          "bytes": 17130,
          "sha256": "0fbd5393937f35cd0c554a289ed7b290b685e1ee4aa9af7bfe1cba4257288fe0"
        },
        {
          "path": "scripts/compatibility/level4-controller.mjs",
          "bytes": 28225,
          "sha256": "6b347d6ab618099d84c614b6f0142bf818fe075799887e3f980d8af4cac17939"
        },
        {
          "path": "scripts/compatibility/level4-verifier.mjs",
          "bytes": 21750,
          "sha256": "8a56fc5a0136556db9fcadf8be506258989e4863702b329619acdf0f66335490"
        },
        {
          "path": "src/shared/authority-json-runtime.mjs",
          "bytes": 797,
          "sha256": "c7797ea57163f75ef332228bc92d237cadd2c6bfed14e44ddf7714fc67a68224"
        },
        {
          "path": "src/shared/level4-receipt-boundary.mjs",
          "bytes": 44915,
          "sha256": "e6bb8a05f8a1cf13e64198f8ae216b50c96c3c039bb5426687db563fa8f4fc6f"
        }
      ]
    },
    "allowedReceiptSchemaVersions": [2],
    "currentHarness": {
      "version": "level4-harness-v1-phase0",
      "treeSha256": "719f05c28977ba2275434efb9340f5c944056afc0ad771aafac44e2d3f9e09e4"
    }
  },
  "issuerKeys": []
}
